{
  "namePool": {
    "Fighter":        ["Galvin", "Bram", "Halvar", "Hedda", "Oswin", "Brogan", "Maud", "Tolly", "Gerd", "Jorun"],
    "Archer":         ["Ren", "Wren", "Talia", "Hob", "Ada", "Linnet", "Colm", "Tamsin", "Perrin", "Edda"],
    "Mage":           ["Lira", "Theron", "Elara", "Isolde", "Maren", "Ansel", "Corin", "Sabeth", "Tobiah", "Vell"],
    "Cavalier":       ["Aldric", "Helena", "Rowena", "Cyrus", "Leona", "Garrick", "Oriel", "Benet", "Marisse", "Tancred"],
    "Cleric":         ["Miriel", "Iona", "Caelen", "Althea", "Brynn", "Anselm", "Hilde", "Pell", "Constance", "Tobin"],
    "Myrmidon":       ["Soren", "Kael", "Hana", "Yara", "Ilse", "Teo", "Mirel", "Daska", "Oren", "Sefa"],
    "Thief":          ["Nyx", "Wicker", "Sparrow", "Rook", "Pim", "Fen", "Lark", "Mags", "Dobbin", "Tess"],
    "Mercenary":      ["Gareth", "Kestrel", "Brandt", "Sigrid", "Valen", "Ottar", "Rennick", "Jessa", "Hollis", "Morrow"],
    "Pegasus Knight": ["Elysia", "Aerin", "Iris", "Ilka", "Neve", "Sabine", "Tarin", "Coralie", "Evin", "Maelis"],
    "Knight":         ["Osric", "Gunther", "Ingrid", "Baldric", "Helga", "Aldo", "Wendel", "Brunna", "Hamond", "Petra"],
    "Dancer":         ["Sylvie", "Aria", "Liesl", "Nico", "Zora", "Mira", "Anouk", "Esme", "Jaro", "Pia"],
    "Wyvern Rider":   ["Draven", "Ragna", "Torvi", "Hakon", "Ysolt", "Brenna", "Ulf", "Kari", "Stig", "Asta"],
    "Wyvern Lord":    ["Drakon", "Varga", "Hrolf", "Sunniva", "Eirik", "Thyra", "Orm", "Grisel", "Bjarke", "Vigdis"],
    "Hero":           ["Dante", "Corwin", "Aldous", "Mathea", "Ivo", "Branwen", "Garret", "Ysabel", "Tomas", "Radek"],
    "Falcon Knight":  ["Celeste", "Adela", "Liane", "Orla", "Vianne", "Kestra", "Solenne", "Ardis", "Emeric", "Rhosyn"],
    "Sage":           ["Vaelan", "Ottoline", "Castor", "Beneda", "Aurin", "Hesper", "Lucan", "Ismay", "Faustin", "Oriane"],
    "Assassin":       ["Shade", "Vesna", "Kiran", "Silas", "Maro", "Nell", "Duvik", "Senna", "Tavi", "Riss"],
    "Sniper":         ["Faye", "Vera", "Aldis", "Garran", "Mott", "Isra", "Keffa", "Bodil", "Ansa", "Lowen"],
    "Bishop":         ["Io", "Aurel", "Clement", "Benedetta", "Oswald", "Agathe", "Piran", "Honora", "Lucius", "Vivia"],
    "Paladin":        ["Aldric", "Godric", "Emmeline", "Bertrand", "Clovis", "Amara", "Lothar", "Genevra", "Hugo", "Wilmot"],
    "Warrior":        ["Galvin", "Dagna", "Horst", "Ulrike", "Barnaby", "Grig", "Magnus", "Otho", "Runa", "Tarvek"]
  },
  "act1": {
    "levelRange": [1, 3],
    "classPool": ["Fighter", "Archer", "Mage", "Cavalier", "Cleric", "Myrmidon"]
  },
  "act2": {
    "levelRange": [5, 8],
    "classPool": ["Thief", "Mercenary", "Pegasus Knight", "Wyvern Rider", "Mage", "Knight", "Cavalier", "Dancer"]
  },
  "act3": {
    "levelRange": [5, 8],
    "classPool": ["Hero", "Falcon Knight", "Wyvern Lord", "Sage", "Assassin", "Sniper", "Bishop"]
  },
  "act4": {
    "levelRange": [12, 16],
    "classPool": ["Hero", "Sage", "Sniper", "Paladin", "Wyvern Lord", "Warrior", "Bishop"]
  }
}
